,DBRECORDID,TITLE,ABSTRACT,LANGUAGE,cosine_scores
21784,M28382735,"Michael J. Rennie: a perspective on a scientist whose life's work helped sculpt knowledge about the regulation of the musculoskeletal system by nutrition, exercise and inactivity.",,eng,0.701340793843105
980179,M817236,"Nutriton classics. Public Health Reports, Volume 56, 1941, pages 761-792. Domestic water and dental caries. II. A study of 2,832 white children, aged 12-14 years, of 8 suburban Chicago communities, including Lactobacillus acidophilus studies of 1,761 children. By H. Trendley Dean, Philip Jay, Francis A. Arnold, Jr., and Elias Elvove.",,eng,0.7004711422721783
1082386,M920166,"Patients at a paediatric out-patient clinic. A study with particular reference to psychological and social background factors. II. Earlier contacts with the health service, social background, parents' morbidity, general discussion and recommendations.","Psychological factors were considered by the examining physicians to play an important part in 5.2% of approximately 4 000 initial visits to a paediatric clinic. These cases are compared with a matched control group representing the cases where the physicians judged that psychological factors were not involved. As compared with the controls, then a considerably larger proportion of the patients with symptoms associated with psychological factors had a previous history of contacts with child psychiatrists or attendence at the paediatric clinic for problems of a psychological nature. Their parents, the mothers in particular, had a higher frequency of registered sickness for mental-nervous disorders and their families had more frequently been the subject of special social inquiries or assistance. To a large extent the examining paediatrician was unaware of these background conditions. With a better case history and proper follow-up one could probably reduce the number of X-ray examinations, consultations and laboratory tests. Further training and better contacts would be facilitated if members of a children's psychiatric team were stationed within the paediatric clinic.",eng,0.7003942227400055
437351,M257309,Recent surveys show John Q. Public thinks nurses function best as handmaidens to the physician.,,eng,0.7003197579165492
47232,M27792815,"Maureen T. Hannley, PhD: Contributions to the development of generational cohorts of surgeon-investigators in otolaryngology-head and neck surgery: A role model for us all [Guest Editorial].",,eng,0.6999218407719695
